Project Achievements in Burundi,"ABS Burundi has been implementing a project LINKUP for three years from 2013 to 2015 with an extention to June 2016. The aim of the project was to contribute to reduce unintended pregnancies, HIV tranmission and HIV-related maternal mortality amongst young people from PLHIV, people who sell sex and MSM by increasing health seeking behaviours and uptaking quality integrated maternal health, family planning and HIV information, services and commodities amongst young people and key populations and uphold their sexual and reproductive rights.",Evaluation,,,Completed,2016,,Link UP,Burundi,,,,Primary study,Internal,en,Y,Closed access,© Nkurunziza Menus and Nininahazwe Cédric,No,Observational (baseline targets compared to mid-point state),"People affected by HIV; young PLHIV; sex workers; MSM; youth",12;11;16,"Mobilization, education and norms change interventions (incl. behavioural and empowerment interventions); Counseling and psycho-social support interventions; Interventions aimed to influence HIV-related laws policies and practices of policy makers",,17;18;25;35;36;40,"Increased knowledge about HIV; Positive behaviour change (individual level); Increased access to voluntary counselling and testing; Increased access to STI screening; Increased access to reproductive health options, including abortion; Reduced discrimination and stigma around HIV",,Low
Qualitative Impact Assessment of Pehchan Programme,"India HIV/AIDS Alliance (hereafter, ‘Alliance’), along with its 6 consortium partners, has been
implementing Pehchan, a GFATM-funded programme targeted towards HIV prevention
among MSM, Transgender, and Hijra (MTH) communities in 18 priority states of India, in two
phases between 2010 and 2015. The programme is focused around community systems
strengthening, capacity building of the community-based organisations (CBOs), and creating
evidences for policy changes related to the MTH communities. Pehchan’s objectives2 were:
(1) establishing and strengthening CBOs, (2) increasing the coverage of MTH communities,
(3) strengthening of health systems and engagement of MTH community systems, and (4)
creating an enabling environment.
Alliance commissioned a qualitative impact assessment, which was conducted by the Centre
for Sexuality and Health Research and Policy (C-SHaRP). This report presents the findings
from this qualitative impact assessment. ",Evaluation,,,Completed,2016,,India AIDS Alliance,India,,,,Primary study,Internal,en,Y,Closed access,© International HIV/AIDS Alliance,No,Observational (Midterm and endpoint comparison design - explanatory multiple-case study approach),"Transgender populations; MSM",12;11;15;13;14;16,"Mobilization, education and norms change interventions (incl. behavioural and empowerment interventions); Counseling and psycho-social support interventions; Socioeconomic approaches; Interventions addressing stigma, discrimination and violence, including gender-based violence prevention and treatment programs; Inteventions aimed at removing human rights- and gender-related barriers (incl. Legal services interventions); Interventions aimed to influence HIV-related laws policies and practices of policy makers",,17;20;40;25;35;36;42,"Increased knowledge about HIV; Other (not closely related to HIV,  e.g. self esteem, access to formal education, employment, etc.) [access to social entitlements]; Reduced discrimination and stigma around HIV; Increased access to voluntary counselling and testing; Increased access to STI screening; Increased access to reproductive health options, including abortion; Challenging of harmful gender and social norms ",,High
Impact of training and capacity building of health care providers on providing quality health care services: A study of rural India,"Young married women (YMW) and adolescent girls do not obtain health care from early childhood until their first pregnancy. The current study aimed at strengthening Health Care Providers (HCPs) like Master Trainers, Auxiliary Nurse Midwifery, Accredited Social Health Activist and Anganwadi Workers, on preconception care through trainings and capacity building and assesses skillshift. Pre and post-test quantitative-experimental study design was used.",Research (published),,"Young married women / Adolescents
Health care",Published,Feb-18,Sunil Mehra,MAMTA,India,"Impact of training and capacity building of health care providers on providing quality health care services: A study of rural India: Dr. Simi, Sumitra, Jagannath, Dr. Navin, Sonali, Dr. Sunil Mehra: Journal of Women Health",https://doi.org/10.4172/2325-9795.1000301,,Primary study,Internal,en,Y,Closed access,© SciTechnol; J Womens Health Issues Care,Yes,Quasi-experimental (Pre and post-test quantitative-experimental study design ),Young women,12,"Mobilization, education and norms change interventions (incl. behavioural and empowerment interventions)",,36;17;38,"Increased access to reproductive health options, including abortion; Increased knowledge about HIV; Increased access to conception and pregnancy care",,Moderate
