Improving prevention and care for HIV and sexually transmitted infections among men who have sex with men in Cambodia: the sustainable action against HIV and AIDS in communities ,The prevalence of HIV and sexually transmitted infections among key populations in Cambodia continues to rise. KHANA developed and implemented the Sustainable Action against HIV and AIDS in Communities (SAHACOM) project. This study aims to determine the impacts of the SAHACOM on sexual behaviors and the uptake of HIV/STI services among men who have sex with men in Cambodia.,Research (published),,KP: MSM,Completed,2016,Yi Siyan ,KHANA,Cambodia,BMC Health Serv Res. 2016 Oct 21;16(1):599.,https://doi.org/10.1186/s12913-016-1857-9,,Primary study,Internal,en,Y,Open access,"© The Author(s). 2016 Open Access This article is distributed under the terms of the Creative Commons Attribution 4.0
International License (http://creativecommons.org/licenses/by/4.0/)",No ,Observational (Midterm and endpoint comparison design),MSM,1;2;7;12,"Condoms (male and female) and lubricant programming; HIV care, testing and treatment (incl. adherence and monitoring) services; Diagnosis and treatment of sexually transmitted infections (other than HIV) and other sexual health services; Mobilization, education and norms change interventions (incl. behavioural and empowerment interventions)",,17;20;18;1;5;19,"Increased knowledge about HIV; Other (not closely related to HIV,  e.g. self esteem, access to formal education, employment, etc.) [Increased self-efficacy]; Positive behaviour change (individual level); Increased condom use; Improved adherence to ART; Improved sexual and reproductive health (e.g. reduction in STIs, increased use of reproduction options) outcomes",Increased self-efficacy,Moderate
Health and Socio-economic Impacts of Livelihoods Programs among People Living with HIV in Cambodia: A Case-Control Study.," In Cambodia, the circumstances surrounding PLHIV remain serious conditions. KHANA has implemented livelihoods programs since 2010. This study aims to evaluate the impacts of the programs in improving socio-economic conditions, health, and psychological well-being of PLHIV in Cambodia.",Research (published),,"PLHIV, Livelihood",Completed,2016,Yi Siyan ,KHANA,Cambodia,"American Journal of Public Health Research
Vol. 4, No. 5, 2016, pp 159-169",http://www.sciepub.com/AJPHR/content/4/5,,Primary study,Internal,en,Y,Closed access,© Science and Education Publishing,No,Quasi-experimental (Unmatch case-control study),PLHIV,15,Socioeconomic approaches,Livelihoods intervention,20,"Other (not closely related to HIV,  e.g. self esteem, access to formal education, employment, etc.) [Increased food security, increased school adherence, increased economic security]","Increased food security, increased school adherence, increased economic security",Moderate
Expanding the role of community mobilization to accelerate progress towards ending vertical transmission of HIV in Uganda: the Networks model.,"In the context of current shortfalls in the prevention of vertical HIV transmission, this paper presents the results of the Networks project, a community mobilisation model implemented by the International HIV/AIDS Alliance in Uganda, and draws out the theoretical foundations and promising community mobilization practices relevant to prevention of vertical transmission.",Research (published),Link-Up,"Community mobilization, HIV",Completed,2012,Gitau Mburu,Alliance Secretariat,Uganda,J Int AIDS Soc. 2012 Jul 11;15 Suppl 2:17386. doi: 10.7448/IAS.15.4.17386.,https://dx.doi.org/10.7448%2FIAS.15.4.17386,,Primary study,Internal,en,Y,Open access,© 2012 Gitau-Mburu D et al; licensee International AIDS Society. This is an open access article distributed under the terms of the Creative Commons Attribution License (http://creativecommons.org/licenses/by-nc/3.0/),No,Observational (Retrospective evaluation) ,PLHIV,12,"Mobilization, education and norms change interventions (incl. behavioural and empowerment interventions)",,6;7;17;18;44;45,Increased use of voluntary counselling and testing; Increased use of PMTCT sevices; Increased knowledge about HIV; Positive behaviour change (individual level); Increase in capacity of communities to be safe and supportive; Positive social transformation (community level) ,"the Networks model increased the uptake of decentralized
interventions for preventing vertical transmission through community referrals; promoted male involvement through peer sensitisation; and linked communities to advocacy channels for advancing maternal health and prevention of vertical HIV transmission",Low
Encouraging Young Married Women (15-24 Years) to Improve Intra-Spousal Communication and Contraceptive Usage through Community Based Intervention Package in Rural India, The present study was conducted to understand the effect of a community based intervention package on awareness and motivation for contraceptive use to delay pregnancy among young married couples through improving intra-spousal communication.,Research (published),,"Young married women, contraception, community intervention",Completed,2016,,MAMTA,India,Journal of Contraceptive Studies. 2016;1:4,http://contraceptivestudies.imedpub.com/encouraging-young-married-women1524-years-to-improve-intraspousalcommunication-and-contraceptive-usagethrough-community-based-inte.php?aid=11144,,Primary study,Internal,en,Y,Closed access,© Copyright iMedPub,No,"Quasi-experimental (Unmatch case-control study – 2 intervention arms in two geographic locations, one control arm; population-based household surveys) ",Youth; Young women,12,"Mobilization, education and norms change interventions (incl. behavioural and empowerment interventions)",Communication intervention,19,"Improved sexual and reproductive health (e.g. reduction in STIs, increased use of reproduction options) outcomes",,Low
"Bringing testing to the people - benefits of mobile unit HIV/syphilis testing in Lima, Peru, 2007–2009","Our study aimed to evaluate demographic and behavioral characteristics and HIV and syphilis prevalence and associated factors of a non-profit HIV/STI testing MU in Lima, Peru to determine whether mobile testing could provide an effective complement to traditional, clinic-based testing services.",Research (published),,Mobile testing,Completed,2014,Robinson Cabello,Via Libre,Peru,Int J STD AIDS. 2014 Apr; 25(5): 325–331.,https://dx.doi.org/10.1177%2F0956462413507443,,Primary study,Internal,en,Y,Closed access,© Copyright SAGE Publications,No ,Quasi -experimental (non-equivalent groups comparison; Survey),High risk populations; MSM; Transgender women,2;7,"HIV care, testing and treatment (incl. adherence and monitoring) services; Diagnosis and treatment of sexually transmitted infections (other than HIV) and other sexual health services",Mobile units offering HIV/STI testing services and voluntary counseling and reference services,6;26;35,increased use of couseling and testing; increased access to ART; increased access to STI screening,"Primary outcomes were HIV and syphilis prevalence and HIV prevalence among participants who have never before
been tested for HIV (first-time testers) in the MU; providing HIV and Syphilis treatment",Moderate
Community Systems Strengthening for HIV Care: Experiences From Uganda,"In Uganda, where the number of people with HIV is increasing against a background of weak health systems, the role of community systems is poorly understood. We investigated the role of community systems in palliative care and the system elements required for an effective community response in Uganda.",Research (published),,"Community mobilization, HIV",Completed,2013,Gitau Mburu,Alliance Secretariat,Uganda,J Soc Work End Life Palliat Care. 2013 Oct; 9(4): 343–368.,https://doi.org/10.1080/15524256.2013.846889,,Primary study,Internal,en,Y,Open access,"© Copyright Gitau Mburu, Danielle Oxenham, Ian Hodgson, Alice Nakiyemba, Janet Seeley, and Alvaro Bermejo",No ,Observational (Focus groups; interviews),PLHIV; recipients of palliative care and their families,2;8;11,"HIV care, testing and treatment (incl. adherence and monitoring) services; prevention, diagnosis and treatment of opportunistic infections; couselling and psycho-social support",community based pallitive care,26;34;20;5,increased access to ART; increased access to mental health support; other (care of children after death of parents); other (increased nutrition); other (increased livelihood support); improved adherence to ART,"personal care, treatment access and adherence support, financial support, bereavement support, and care of children after the death of their parents; linking people living
with HIV to a comprehensive range of services—including treatment, nutrition, and livelihood support.",Moderate
Effect of an Online Video-Based Intervention to Increase HIV Testing in Men Who Have Sex with Men in Peru,"Although many men who have sex with men (MSM) in Peru are unaware of their HIV status, they are frequent users of the Internet, and can be approached by that medium for promotion of HIV testing",Research (published),,,Completed,2010,Robinson Cabello,Via Libre,Peru,PLoS One. 2010; 5(5): e10448.,https://dx.doi.org/10.1371%2Fjournal.pone.0010448,,Primary study,Internal,en,Y,Open access,© Copyright Blas et al. ,No,"Experimental (RCT)
",MSM,12,"Mobilization, education, and norms change",HIV-testing motivational videos,6,Increased use of voluntary conselling and testing,visit to the clinic to get testing,HIgh
"Effectiveness of an Integrated Community- and Clinic-Based Intervention on HIV Testing, HIV Knowledge, and Sexual Risk Behavior of Young Men Who Have Sex With Men in Myanmar","Young men who have sex with men (YMSM) in Myanmar are disproportionately affected by HIV, with prevalence five times that of the general population. The Link Up project implemented an intervention using peer education and outreach providing education and counseling on health seeking around sexually transmitted infections and reproductive health, combined with focused clinic capacity building to improve the sexual and reproductive health of YMSM. This study aimed to evaluate the effectiveness and acceptability of the intervention.",Research (published),Link-Up,KP: YMSM,Published,2017,"Luisa Orza,
Georgina Caswell,
Felicia Wong",,Myanmar,"Effectiveness of an Integrated Community- and Clinic-Based Intervention on HIV Testing, HIV Knowledge, and Sexual Risk Behavior of Young Men Who Have Sex With Men in Myanmar Poe Poe Aung, Claire Ryan, Ashish Bajracharya, Naanki Pasricha, Zaw Win Thein, Paul A. Agius, Than Tun Sein, Lisa Willenberg, Ei Mon Soe, Ne Tun Zaw, Waimar Tun, Eileen Yam, Stanley Luchters",https://doi.org/10.1016/j.jadohealth.2016.09.006,,Primary study,Internal,en,Y,Closed access,© Copyright Elsevier; Journal of Adoloscent Health,Yes,Quasi-experimental (mixed methods; pre- and post-intervention cross-sectional survey and focus groups),Youth; MSM,12;11;7;17,"Mobilization, education, and norms change; Counselling and psycho-social support; Diagnosis and treatment of sexually transmitted infections (other than HIV) and other sexual health services; Other (clinic capacity building)","peer education and outreach providing education and counseling on
health seeking around sexually transmitted infections and reproductive health, combined with
focused clinic capacity building to improve the sexual and reproductive health of YMSM.",6;17,Increased use of cvoluntary counselling and testing; Increased knowledge about HIV,"greater proportion of HIV-negative or unknown statusYMSMaccessed HIV testing in the past 3
months in intervention townships; improvements in accessing HIV-related knowledge",Moderate
Patterns of Attendance at Mother Support Groups in Zimbabwe. The EPAZ Trial (2014–2016)," Women living with HIV attended MSG sessions. However, few attended regularly. Younger and newly diagnosed women were less likely to attend postpartum MSG sessions or remain in care at 12 months postpartum. Peer support models should consider specific needs of these women, especially in rural areas, in order for MSGs to contribute to improve maternal and child health outcomes.",Research,,,Published,2017,,,Zimbabwe,,http://doi.org/10.1097/QAI.0000000000001348,,Primary study,Internal,en,Y,Open Access,"© Wolters Kluwer Health, Inc. All rights reserved",No,Observational (Cluster analysis and mixed-effects binomial models),HIV positive mothers,11;12,"Counseling and psycho-social support interventions; mobilization, education and norms change interventions (incl. behavioural and empowerment interventions)",Mother support groups; peer psycho-social support,10;6,Increased retention in care on ART; Increased use of voluntary counselling and testing,Increased retention in care after the first 12 months postpartum,Moderate
Impact of Facility-Based Mother Support Groups on Retention in Care and PMTCT Outcomes in Rural Zimbabwe: The EPAZ Cluster-Randomized Controlled Trial,We were unable to show that facility-based MSGs improved retention in care at 12 months among HIV-exposed infants. Selective enrollment of mothers more likely to be retained-in-care may have contributed to lack of effect. Methods to increase the impact of MSGs on retention including targeting of high-risk mothers are discussed.,Research,,,Published,2017,,,Zimbabwe,,http://doi.org/10.1097/QAI.0000000000001360,,Primary study,Internal,en,Y,Open Access,"© Wolters Kluwer Health, Inc. All rights reserved",Yes,Experimental (Cluster-Randomized Controlled Trial),Young mothers; HIV positive mothers,11;12,"Counseling and psycho-social support interventions; Mobilization, education and norms change interventions (incl. behavioural and empowerment interventions)",Mother support groups; peer psycho-social support,10;6,Increased retention in care on ART; Increased use of voluntary counselling and testing,"Increased infant retention in care defined as “12 months postpartum point attendance""",Moderate
Impact of peer education and on site clinical services for female sex workers in Bangladesh brothels,Evaluation study conducted in Bangladesh by the Population Council for the Link Up project. May 2016.,Evaluation,Link-Up,"KP: FSW, peer-education",Completed,2016,Anna Downie,Population Council,Bangladesh,Published on Inspire. ,https://www.popcouncil.org/uploads/pdfs/2016HIV_LinkUp_BangladeshFSWsBrief.pdf,,Primary study,Internal,en,Y,Open Access,"© The Population Council, Inc.",Yes,Observational (bivariate analysis),"High risk populations, female sex workers",1;2;7;11;12,"Condoms (male) and lubricant programming; HIV care, testing and treatment (incl. adherence and monitoring) services; Diagnosis and treatmetn of sexually-transmitted infections (other than HIV) ad other sexual health services; Counselling and psycho-coaial support interventions; Mobilization, education, and norms change interventions (incl. behavioural and empowerment interventions). ","brothel-based HIV and sexual and reproductive health and rights (SRHR) intervention; ongoing face-to-face outreach with residents in the brothel in one-on-one and group sessions, providing basic information on HIV prevention and SRHR; clinic personnel providing family planning counseling and methods (pill, injectable, and male condoms), HIV testing and counseling, STI diagnosis and treatment, antenatal and postnatal care, general pediatric and adult health consultations.",17;18,Increased knowledge about HIV; Positive behaviour change,improved SRHR knowledge and behaviors among women who sell sex; higher knowledge about HIV transmission; increased HIV testing; increased condom use,Moderate
An integrated peer outreach and clinic based intervention to improve the sexual health of young MSM in Myanmar,Baseline and endline evaluation study conducted by the Population Council under Link Up (May 2016),Evaluation,Link-Up,"KP: Young MSM, SRHR, peer outreach",Completed,2016,Anna Downie,"Population Council, Alliance Myanmar, Burnet Institute and MR",Myanmar,Published on Inspire. ,https://www.popcouncil.org/uploads/pdfs/2016HIV_LinkUp_MyanmarEndlineBrief.pdf,,Primary study,Internal,en,Y,Open Access,"© The Population Council, Inc.",Yes,Quasi-experimental (pre- and post-intervention cross-sectional survey),Youth; MSM,1;2;7;11;12,"Condoms (male) and lubricant programming; HIV care, testing and treatment (incl. adherence and monitoring) services; Diagnosis and treatmetn of sexually-transmitted infections (other than HIV) ad other sexual health services; Counselling and psycho-social support; Mobilization, education and norms change; Interventions aimed at addressing stigma, discrimination and violence","peer-driven intervention for young MSM in Myanmar; outreach by peer educators; provided MSM in their community with condoms and lubricants, counseling, and referrals to appropriate services; a clinic based service offered HIV counseling and testing, STI screening and treatment, psychosocial support, and sexual health counseling",1;6;18;40;25;35,Increased condom use; increased use of voluntary counselling and testing; positive behaviour change (individual level); reduced discrimination and stigma around HIV (in particular MSM with HIV); increased access to voluntary counselling and testing; Increased access to STI screening,"increased use of voluntary conselling and testing; decrease in the percentage of MSM who reported unprotected anal sex in the last 30 days; sensitizing service providers on respectful MSM treatment
and care; MSM clients receiving both HIV and STI testing services",Low
Is the promise ofmethadone Kenya’s solution to managing HIV and addiction? A mixed-method mathematical modelling and qualitative study. ,"Promoted globally as an evidence-based intervention in the prevention of HIV and treatment of heroin addiction among PWID, OST can help control emerging HIV epidemics among PWID. With implementation in December 2014, Kenya is the third Sub-Saharan African country to have introduced OST. We combine dynamic mathematical modelling with qualitative sociological research to examine the 'promise of methadone' to Kenya.",Research (published),,Harm Reduction,Completed,2015,"Andy Guise, Tim Rhodes","KANCO, LSHTM, Alliance Secretariat",Kenya,BMJ Open. 2015 Mar 6;5(3):e007198,http://dx.doi.org/10.1136/bmjopen-2014-007198,,Primary study,Internal,en,Y,Open Access,© BMJ Medical Group Ltd.,No,Quasi-experimental (mathematical modelling and qualitative data analyses),PWID,10,Opiod subsitution therapy and other drug dependence treatment / overdose prevention and management programmes,"implementing methadone in
low-income settings in Kenya",12;19;29,Increased use of opiod substitution therapy; improved sexual and reproductive heatlth outcomes; increased access to opiod susbstitution therapy; ,reductions in HIV incidence and prevalence among people who inject drugs linked to the implementation of OST,High
"Looking In, Looking Out: A formative evaluation of the LILO KP methodology in Kenya and Zimbabwe",Interviews with participants immediately after training to assess changes in their attitudes.,Evaluation,KP Connect,"KP: LGBT
LILO",Completed,2016,Cat Simmons,,"Kenya;Zimbabwe","Public Health Action, Vol7, No 2, June 2017",,,Primary study,Internal,en,Y,Closed access,© Lucy Soar,No,Observational (semi-structed interviews),High risk populations,13,"Interventions addressing stigma, discrimination and violence, including gender-based violence prevention and treatment programs",Sensitise people working with MSM and SW through building empathy with KPs; ,40;43;20,Reduced discrimination and stigma surrounding HIV; Challenging of harmful gender and social norms; Other (increased understanding of non-KP views and the need to work with them),"Key populations increased their understanding of the attitudes towards them, and the need to work with the heterosexual community; Non KPs training. Non-KPs described positive shifts in their attitudes towards KPs as a result of the training, and consequently being more confident in talking about their work and KP issues with their families and communities; ",Moderate
Mid- Term Review of Link-Up,Research Report,Evaluation,,,Completed,2017,,India AIDS Alliance,India,,,,Primary study,Internal,en,Y,Closed access,© Bastian Schwarz,No,Observational (interviews; thematic analysis; focus group discussions),"young people living with HIV; sex workers; men who have sex with men; transgender people and people who use drugs",2;11;12;13,"Not clearly stated in the document as it is a mid-term review; HIV care, testing and treatment; counselling and psycho-social support interventions; mobilization, educationnd norms change interventions (incl. behavioural and empowerment interventions); interventions addressing discrimination and violence, including gender-based violence prevention and treatment programs. ","Improving the integration of SRHR interventions into existing community- and facility-based HIV programmes; Targeted outreach services which take services to young people from key populations;  Demand side financing schemes such as vouchers which target specific groups of young people and provide access to free services at social franchise clinics; The use of information and communication technologies (ICT) and social media to provide targeted, accurate information to young people from key populations; A new community based system, monitoring system - Rights – Evidence – ACTion (REAct), to support evidence for rights based approaches has been developed and rolled out; Research evidence on the impact of Link Up and exploratory research filling knowledge gaps about effective services for young people from key populations. Case studies documenting best practices are now starting to be collated.",17;6;19;35;44;40;43;36,Increased knowlseg about HIV; Increased use of voluntary couselling and testing; Improved sexual and reproductive health outcomes; Increased access to STI screening; increase in capacity of communities to be safe and supportive; reduced stigma around HIV; challenging of harmful gender and social norms; increased access to reproductive health options,"Young people are better informed and are thus able to make healthier choices regarding their sexuality; Growing No. of young people have access to ART, contraceptives & other commodities required for good sexual & reproductive health; Public & private clinics provide better sexual & reproductive healthcare services, which more & more people are using; Greater respect for the sexual & reproductive rights of people to whom these rights are denied; capacity of networks for young people from key population have been strengthened allowing these networks to expand their reach; Young People have increased their individual skills, knowledge and confidence.",Moderate
Positive Impact: Report of the Mid Term Review,Report,Evaluation,A UK BIG Lottery International Communities Project,,Report Completed,2015,Anna Downie,P.V ,Namibia,,,,Primary study,Internal,en,Y,Closed access,"© UK BIG Lottery International Communities Project
Implemented by the International HIV&AIDS Alliance and Positive Vibes, Namibia",No,Observational (interviews; field observations; literature review),PLHIV,2;11;12;13,"HIV care, testing and treatment (incl. adherence and monitoring) services; Counselling and psycho-social support interventions; Mobilization, education, and norms interventions (incl. Behavioural and empowerment interventions; Interventions addressing stigma, discrimination and violence, including gender-based violence prevention and treatment programs;","Initial cadre of 15 RF and CBF were trained/retrained for this project; delivery of updated Inside-Out training packages to a total of 2000 support group members, newly diagnosed PLHIV and people with identified treatment adherence problems as referred from local clinics and home-based HIV-testing and defaulter tracing service provider DAPP/TCE; activities include sensitisation of service providers to PLHIV perspectives and needs through Inside-Out trainings, regular clinic visits of community-based facilitators to support and promote referrals from and to community-based services and the distribution of informational materials at clinics.",5;20;18;19;42;6;8;5;40;44,Improved adherence to ART; Other (greater self esteem and confidence); Postive behavior change (individual level); Improved sexual and reproductive health (increased use of reproduction options) outcomes; enabling public policy environment; increased use of voluntary counselling and testing; improved uptake of ART; improved adherence to ART; reduced discrimination and stigma around HIV; increased capacity of communities to be safe and supportive; ,"support group members report greater self-confidence and self-esteem and provide practical examples how this has translated into healthier behaviours, including sexual risk reduction, greater adherence to ARV treatment and increased uptake of family planning services; PLHIV representation at constituency level",Moderate
